{"$schema":"https://json-schema.org/draft/2020-12/schema","type":"object","additionalProperties":false,"required":["audit_id","seed_id","source_receipts","mapped_roles","fragility","independent_check","material_mismatch","disposition","failed_gate","plain_language_verdict","next_permitted_action"],"properties":{"audit_id":{"const":"system-one-seed-full-audit-1"},"seed_id":{"const":"seed-home-range-calibration"},"source_receipts":{"type":"array","minItems":2,"items":{"type":"object","additionalProperties":false,"required":["url","location","finding"],"properties":{"url":{"type":"string","format":"uri"},"location":{"type":"string","minLength":10},"finding":{"type":"string","minLength":40}}}},"mapped_roles":{"type":"object","additionalProperties":false,"required":["system","unit","measurement","published_baseline","published_inference","claim_boundary"],"properties":{"system":{"type":"string","minLength":20},"unit":{"type":"string","minLength":15},"measurement":{"type":"string","minLength":20},"published_baseline":{"type":"string","minLength":30},"published_inference":{"type":"string","minLength":30},"claim_boundary":{"type":"string","minLength":30}}},"fragility":{"type":"object","additionalProperties":false,"required":["named","alternative_explanation"],"properties":{"named":{"type":"string","minLength":30},"alternative_explanation":{"type":"string","minLength":30}}},"independent_check":{"type":"string","minLength":40},"material_mismatch":{"type":"string","minLength":40},"disposition":{"const":"failed-gate-rejection-receipt"},"failed_gate":{"const":"prior-art-nontriviality"},"plain_language_verdict":{"type":"string","minLength":40},"next_permitted_action":{"type":"string","minLength":30}}}
