{"audit_id":"system-one-seed-full-audit-1","seed_id":"seed-home-range-calibration","source_receipts":[{"url":"https://doi.org/10.1111/2041-210X.13270","location":"Title and article scope: overcoming small effective sample sizes in home-range estimation.","finding":"The published method already frames and addresses the small-effective-sample-size problem that the seed's calibration sensitivity check would otherwise investigate."},{"url":"https://zenodo.org/records/4976491","location":"tapir.zip README: calibration data 1–5; tapir data; uere.fit and VAR.xy.","finding":"The official package supplies five calibration datasets and states that its calibrated error variance is calculated from them for the final tapir analysis."}],"mapped_roles":{"system":"GPS-based animal home-range estimation using a Telonics collar.","unit":"Individual location fixes and separate opportunistic collar calibration datasets.","measurement":"Projected coordinates, HDOP, location class, and calibrated error variance.","published_baseline":"The package identifies ctmm-format data and uere.fit-derived VAR.xy for the published final analysis.","published_inference":"The paper's stated methodological inference is that the approach addresses small effective sample sizes in home-range estimation.","claim_boundary":"This is a method-specific calibration and effective-sample-size claim, not a biological claim about tapir movement."},"fragility":{"named":"Calibration error and small effective sample size can distort home-range estimates.","alternative_explanation":"An apparent method difference could be fully explained by calibration choice or sampling information already modelled in the published procedure rather than a new methodological failure."},"independent_check":"Hold out one or more of the five calibration datasets, estimate calibration from the remainder, and compare the resulting error characterization before applying it to the separate tapir track.","material_mismatch":"The available calibration datasets are opportunistic measurements from the same collar model, whereas the final movement analysis is a single animal track; a held-calibration result would test transfer sensitivity, not an independent biological replication.","disposition":"failed-gate-rejection-receipt","failed_gate":"prior-art-nontriviality","plain_language_verdict":"REJECTED BEFORE CANDIDATE PACKET — the exact calibration and small-sample concern is the published method's central problem and is already addressed by its supplied procedure. A holdout check could be a useful implementation verification, but it is not yet a distinct, domain-specific investigation.","next_permitted_action":"Retain this full-audit rejection; do not send it to System 2. Continue only with a contrasting pattern whose claimed consequence is not already the source's stated solution."}
